{
  "$schema": "https://json-schema.org/draft/2020-12/schema",
  "$id": "https://getmaipai.github.io/shared/spec/schemas/content-ceiling.schema.json",
  "title": "ContentCeiling",
  "description": "How explicit a generated reply may be for one age band (session-c-brain-and-voice.md step 7). One record per band (child, teen, adult) - not a per-household custom profile yet (that authoring UI is future, deferred work, docs/BACKLOG.md's own 'nine sliders' entry). Governs REGISTER only: how graphic, how frank, how unfiltered a reply's own generated content may be. It is a completely separate, additive concern from spec/safety/ts/classifier.ts's own hard refuse/allow_with_resources categories (self_harm, harmful_request, csam, credible_threat, grooming, pii_extraction, prompt_injection, jailbreak) - checkSafety() never reads a ceiling and never will; `floor` below documents that invariant, it does not implement it. There is no 'unrestricted' band today: reaching past the adult ceiling needs a one-time signed adult acknowledgment (a Grant, session-f-platform-and-trust.md step 7, not yet built) this record does not yet gate - safe-by-default in the meantime, since nothing can set a ceiling higher than what ships here. `topics` (MINOR-TOPICS-01) governs stance, whether and how a subject is engaged; `dials` govern explicitness. A household setting may only choose within a band's `allowed` range, and a `fixed` family takes no setting. Adult records carry no `topics`.",
  "type": "object",
  "additionalProperties": false,
  "required": ["band", "dials", "floor", "hlc"],
  "allOf": [
    {
      "if": {
        "properties": {
          "band": {
            "const": "adult"
          }
        },
        "required": [
          "band"
        ]
      },
      "then": {
        "not": {
          "anyOf": [
            {
              "required": [
                "topics"
              ]
            },
            {
              "required": [
                "family_stories"
              ]
            }
          ]
        }
      }
    },
    {
      "if": {
        "properties": {
          "band": {
            "const": "teen"
          }
        },
        "required": [
          "band"
        ]
      },
      "then": {
        "not": {
          "required": [
            "family_stories"
          ]
        }
      }
    }
  ],
  "properties": {
    "band": {
      "type": "string",
      "enum": ["child", "teen", "adult"],
      "description": "Matches turnEngine.ts's own AgeBand type exactly (birthdate-derived, falling back to role) - one record per value, never a custom slug."
    },
    "dials": {
      "type": "object",
      "description": "Per-category register ceilings, the architecture docs/dev.md's own redesign table names as sound and worth reusing (home-legacy.git's lib/contentPolicy.ts) - each dial's value is this band's MAXIMUM for that category, a household setting may only lower it further, never raise it past what's recorded here.",
      "additionalProperties": false,
      "required": ["profanity", "sexual", "violence", "substances", "crime", "hate", "self_harm", "privacy"],
      "properties": {
        "profanity": { "type": "string", "enum": ["off", "mild", "unrestricted"] },
        "sexual": { "type": "string", "enum": ["off", "suggestive", "unrestricted"] },
        "violence": { "type": "string", "enum": ["off", "moderate", "unrestricted"] },
        "substances": { "type": "string", "enum": ["off", "discuss", "unrestricted"] },
        "crime": { "type": "string", "enum": ["off", "discuss", "unrestricted"] },
        "hate": { "type": "string", "enum": ["off", "fiction", "unrestricted"] },
        "self_harm": { "type": "string", "enum": ["off", "discuss", "unrestricted"] },
        "privacy": { "type": "string", "enum": ["off", "public", "unrestricted"] }
      }
    },
    "floor": {
      "type": "array",
      "description": "Documentation, not enforcement: the classifier's own hard-refuse category names (spec/schemas/safety-result.schema.json's own enum, minus self_harm which is allow_with_resources, never refuse) that no dial value on ANY band, including a future unrestricted one, can ever reach - checkSafety() enforces this unconditionally in code, before any ceiling is ever consulted. Every band's record carries the IDENTICAL array (a fixture/test asserts this); it exists here so a generated binding can display the floor beside the dials it sits under, not to make it configurable.",
      "items": {
        "type": "string",
        "enum": ["harmful_request", "credible_threat", "csam", "grooming", "pii_extraction", "prompt_injection", "jailbreak"]
      },
      "minItems": 1
    },
    "topics": {
      "type": "object",
      "additionalProperties": false,
      "required": [
        "bodies",
        "health",
        "feelings",
        "risk",
        "violence",
        "people",
        "beliefs"
      ],
      "description": "Per-family stance record for a child or teen band (seven families, spec/safety/topic-copy.json holds the sentences the model reads). Absent on the adult record, so an adult's prompt is unchanged.",
      "properties": {
        "bodies": {
          "$ref": "#/$defs/family"
        },
        "health": {
          "$ref": "#/$defs/family"
        },
        "feelings": {
          "$ref": "#/$defs/family"
        },
        "risk": {
          "$ref": "#/$defs/family"
        },
        "violence": {
          "$ref": "#/$defs/family"
        },
        "people": {
          "$ref": "#/$defs/family"
        },
        "beliefs": {
          "$ref": "#/$defs/family"
        }
      }
    },
    "family_stories": {
      "type": "object",
      "additionalProperties": false,
      "required": [
        "default",
        "names"
      ],
      "description": "Child band only: whether Santa Claus, the Tooth Fairy and similar stories are kept (never confirmed or denied). A parent can switch it off per child.",
      "properties": {
        "default": {
          "type": "string",
          "enum": [
            "keep",
            "off"
          ]
        },
        "names": {
          "type": "array",
          "minItems": 1,
          "items": {
            "type": "string",
            "minLength": 1
          },
          "description": "The built-in story names; a parent may add more."
        }
      }
    },
    "hlc": {
      "type": "string",
      "pattern": "^[0-9]+:[0-9]+:[a-z0-9]{6,}$"
    }
  },
  "$defs": {
    "stance": {
      "type": "string",
      "enum": [
        "informative",
        "gentle",
        "redirect",
        "support",
        "protect",
        "neutral"
      ]
    },
    "family": {
      "if": {"properties": {"fixed": {"const": true}}, "required": ["fixed"]},
      "then": {"properties": {"allowed": {"maxItems": 1}}},
      "type": "object",
      "additionalProperties": false,
      "required": [
        "stance",
        "allowed",
        "fixed"
      ],
      "properties": {
        "stance": {
          "$ref": "#/$defs/stance",
          "description": "The band's default stance for this family."
        },
        "allowed": {
          "type": "array",
          "minItems": 1,
          "uniqueItems": true,
          "items": {
            "$ref": "#/$defs/stance"
          },
          "description": "The stances a household setting may choose for this family at this band; always contains `stance`. A fixed family allows exactly its one stance."
        },
        "fixed": {
          "type": "boolean",
          "description": "True when no setting in any scope reaches this family."
        }
      }
    }
  }
}
