{
  "band": "teen",
  "dials": {
    "profanity": "mild",
    "sexual": "off",
    "violence": "moderate",
    "substances": "off",
    "crime": "off",
    "hate": "off",
    "self_harm": "off",
    "privacy": "public"
  },
  "floor": [
    "harmful_request",
    "credible_threat",
    "csam",
    "grooming",
    "pii_extraction",
    "prompt_injection",
    "jailbreak"
  ],
  "topics": {
    "bodies": {
      "stance": "informative",
      "allowed": [
        "informative",
        "redirect"
      ],
      "fixed": false
    },
    "health": {
      "stance": "informative",
      "allowed": [
        "informative"
      ],
      "fixed": true
    },
    "feelings": {
      "stance": "support",
      "allowed": [
        "support"
      ],
      "fixed": true
    },
    "risk": {
      "stance": "informative",
      "allowed": [
        "informative",
        "redirect"
      ],
      "fixed": false
    },
    "violence": {
      "stance": "informative",
      "allowed": [
        "informative"
      ],
      "fixed": true
    },
    "people": {
      "stance": "protect",
      "allowed": [
        "protect"
      ],
      "fixed": true
    },
    "beliefs": {
      "stance": "neutral",
      "allowed": [
        "neutral"
      ],
      "fixed": true
    }
  },
  "hlc": "1757073600000:0:a1b2c3"
}
